{
  "artifact_id": "smolvlm-256m/image-text-generation/tiny/vision/fp32/dynamo/static",
  "call": {
    "args": [],
    "kwargs": [
      "pixel_values",
      "patch_attention_mask"
    ],
    "outputs": "tensor_tuple"
  },
  "config_sha256": "7677cec9d8f4344ac0b5db796ace02c20986f8934d5625dcb0f5885a936ef34e",
  "dialect": "functional",
  "dynamic_constraints": {},
  "exporter": {
    "attention": "eager",
    "cache": false,
    "name": "DynamoExporter",
    "shape_policy": "static",
    "strict": false
  },
  "files": {
    "captures.json": "de1f897c44424fb911df8aab32589c8c8b8698b3fee43ce98205e3fd531d5936",
    "cases.json": "565aacfa4898182618bae026f465b6e7ee5eaf50050f25dc584582cddea152d4",
    "data/constants/model_constants_config.json": "887bf4cc1b0dfea3bdb999c93edd75d68b15e71096d14c738bd30070672977e2",
    "data/weights/model_weights_config.json": "adf0ad4ab508122be568dc518a90e6313393741d9a3a845b30e28106392bf476",
    "models/model.json": "b6fc97120051a5253d28f957db699d17aec10676f927f033b7f577e25c7874c4"
  },
  "graph_sha256": "b6fc97120051a5253d28f957db699d17aec10676f927f033b7f577e25c7874c4",
  "inputs": [
    {
      "dtype": "float32",
      "name": "pixel_values",
      "shape": [
        1,
        3,
        32,
        32
      ]
    },
    {
      "dtype": "bool",
      "name": "patch_attention_mask",
      "shape": [
        1,
        4,
        4
      ]
    }
  ],
  "load_dependencies": [
    "torch"
  ],
  "model_class": "Idefics3ForConditionalGeneration",
  "model_id": "smolvlm-256m",
  "mutations": [],
  "outputs": [
    {
      "dtype": "float32",
      "name": "vision_hidden_states",
      "shape": [
        1,
        16,
        32
      ]
    }
  ],
  "population": "tiny",
  "producer": {
    "architecture": "aarch64",
    "core_override": false,
    "core_revision": "ec594858e9ac79619a2a3e4ba2536945e6975c30",
    "core_source_sha256": "ba920d4dc0ffce490cd1ac2391144907ff417bbc7abe75437515e0e4468b525d",
    "device": "cpu",
    "lock_sha256": "9aa194935d71c862f87b53010a57357fb088e780c879ef23d9aca129f4d11fab",
    "python": "3.13.12",
    "tools_sha256": "5fa008b8e1c6209ffd910248a6babd8348db0e16d4c1de28d64181732e2dee33",
    "versions": {
      "numpy": "2.5.3",
      "pt2-export-core": "0.1.0",
      "safetensors": "0.8.0",
      "torch": "2.13.0+cpu",
      "torchvision": "0.28.0+cpu",
      "transformers": "5.18.0"
    }
  },
  "recipe_sha256": "233c219ad84f9fa8b3ac9424dbe0cf2dca7e1f0d7d3a8fc0d0db816fe4e87057",
  "schema_version": 1,
  "tolerances": {
    "atol": 1e-05,
    "rtol": 0.0001
  },
  "verified_cases": 2,
  "weights": {
    "kind": "random",
    "model_seed": 0
  }
}
