{
  "artifact_id": "sam-vit-base/prompted-segmentation/tiny/forward/fp32/dynamo/static",
  "call": {
    "args": [],
    "kwargs": [
      "pixel_values",
      "input_points",
      "input_labels"
    ],
    "outputs": "tensor_tuple"
  },
  "config_sha256": "614739510bafb129b36d716c28bdaad87bbf9c8e48e1baac599265c39e2399f7",
  "dialect": "functional",
  "dynamic_constraints": {},
  "exporter": {
    "attention": "eager",
    "cache": false,
    "name": "DynamoExporter",
    "shape_policy": "static",
    "strict": false
  },
  "files": {
    "captures.json": "4d32a966a72d6f6aa2b0f27234a348c4490d73bd4f9d34a1196d2862f326d326",
    "cases.json": "95134e2079636ad209db078a72b239f3acc2c38c743e48db4f9c92c4ea564fb9",
    "data/constants/model_constants_config.json": "65d03bbad65e3dea69e6ee49d647c46718ea0cae617aa3d65b257409c3365079",
    "data/weights/model_weights_config.json": "1a35db91e59d67383d2c331ffdae5447dd1f101f4775ab43d5a1a02e9b2f88ce",
    "models/model.json": "3053221050d796732e5e1202579bb0932aacdfb5ba3b84586cfce5e555de8560"
  },
  "graph_sha256": "3053221050d796732e5e1202579bb0932aacdfb5ba3b84586cfce5e555de8560",
  "inputs": [
    {
      "dtype": "float32",
      "name": "pixel_values",
      "shape": [
        1,
        3,
        64,
        64
      ]
    },
    {
      "dtype": "float32",
      "name": "input_points",
      "shape": [
        1,
        1,
        2,
        2
      ]
    },
    {
      "dtype": "int64",
      "name": "input_labels",
      "shape": [
        1,
        1,
        2
      ]
    }
  ],
  "load_dependencies": [
    "torch"
  ],
  "model_class": "SamModel",
  "model_id": "sam-vit-base",
  "mutations": [],
  "outputs": [
    {
      "dtype": "float32",
      "name": "iou_scores",
      "shape": [
        1,
        1,
        3
      ]
    },
    {
      "dtype": "float32",
      "name": "pred_masks",
      "shape": [
        1,
        1,
        3,
        16,
        16
      ]
    }
  ],
  "population": "tiny",
  "producer": {
    "architecture": "aarch64",
    "core_override": false,
    "core_revision": "ec594858e9ac79619a2a3e4ba2536945e6975c30",
    "core_source_sha256": "ba920d4dc0ffce490cd1ac2391144907ff417bbc7abe75437515e0e4468b525d",
    "device": "cpu",
    "lock_sha256": "9aa194935d71c862f87b53010a57357fb088e780c879ef23d9aca129f4d11fab",
    "python": "3.13.12",
    "tools_sha256": "5fa008b8e1c6209ffd910248a6babd8348db0e16d4c1de28d64181732e2dee33",
    "versions": {
      "numpy": "2.5.3",
      "pt2-export-core": "0.1.0",
      "safetensors": "0.8.0",
      "torch": "2.13.0+cpu",
      "torchvision": "0.28.0+cpu",
      "transformers": "5.18.0"
    }
  },
  "recipe_sha256": "35d8fff1a43f7cacaa27b7543a70752a335b481eff4341d3ea7c7b238f2948b2",
  "schema_version": 1,
  "tolerances": {
    "atol": 1e-05,
    "rtol": 0.0001
  },
  "verified_cases": 2,
  "weights": {
    "kind": "random",
    "model_seed": 0
  }
}
