{
  "artifact_id": "smolvlm-256m/image-text-generation/tiny/prefill/fp32/dynamo/static",
  "call": {
    "args": [],
    "kwargs": [
      "input_ids",
      "attention_mask",
      "image_features"
    ],
    "outputs": "tensor_tuple"
  },
  "config_sha256": "7677cec9d8f4344ac0b5db796ace02c20986f8934d5625dcb0f5885a936ef34e",
  "dialect": "functional",
  "dynamic_constraints": {},
  "exporter": {
    "attention": "eager",
    "cache": true,
    "name": "DynamoExporter",
    "shape_policy": "static",
    "strict": false
  },
  "files": {
    "captures.json": "92f489f9b2e2222bbadb3054476f3a8bcf83d0c85a2769f16245dc34a821b029",
    "cases.json": "ad3a429d2e425dbf119346347ce132dc39ee61df1d6afdb0a39fff3e90ace399",
    "data/constants/model_constants_config.json": "094954a91ab02b6b81da94259f66d794b7c7d17bb45570f0a6977ddcb8fb6027",
    "data/weights/model_weights_config.json": "a3d4f0715154c3bb861c3e9aa4f78201fe462679792f4fbdb0c3535474d0f297",
    "models/model.json": "f87bd02001fcb2620f4f40157a73fa248bc0ae42195dea2c766208a1e39d843a"
  },
  "graph_sha256": "f87bd02001fcb2620f4f40157a73fa248bc0ae42195dea2c766208a1e39d843a",
  "inputs": [
    {
      "dtype": "int64",
      "name": "input_ids",
      "shape": [
        1,
        11
      ]
    },
    {
      "dtype": "int64",
      "name": "attention_mask",
      "shape": [
        1,
        11
      ]
    },
    {
      "dtype": "float32",
      "name": "image_features",
      "shape": [
        1,
        4,
        64
      ]
    }
  ],
  "load_dependencies": [
    "torch"
  ],
  "model_class": "Idefics3ForConditionalGeneration",
  "model_id": "smolvlm-256m",
  "mutations": [],
  "outputs": [
    {
      "dtype": "float32",
      "name": "logits",
      "shape": [
        1,
        11,
        256
      ]
    },
    {
      "dtype": "float32",
      "name": "present_0_key",
      "shape": [
        1,
        1,
        11,
        32
      ]
    },
    {
      "dtype": "float32",
      "name": "present_0_value",
      "shape": [
        1,
        1,
        11,
        32
      ]
    }
  ],
  "population": "tiny",
  "producer": {
    "architecture": "aarch64",
    "core_override": false,
    "core_revision": "ec594858e9ac79619a2a3e4ba2536945e6975c30",
    "core_source_sha256": "ba920d4dc0ffce490cd1ac2391144907ff417bbc7abe75437515e0e4468b525d",
    "device": "cpu",
    "lock_sha256": "9aa194935d71c862f87b53010a57357fb088e780c879ef23d9aca129f4d11fab",
    "python": "3.13.12",
    "tools_sha256": "5fa008b8e1c6209ffd910248a6babd8348db0e16d4c1de28d64181732e2dee33",
    "versions": {
      "numpy": "2.5.3",
      "pt2-export-core": "0.1.0",
      "safetensors": "0.8.0",
      "torch": "2.13.0+cpu",
      "torchvision": "0.28.0+cpu",
      "transformers": "5.18.0"
    }
  },
  "recipe_sha256": "f8b13414833dc6c2d95640cd1785d8389d4b369912f21882c9a382077197f95a",
  "schema_version": 1,
  "state": {
    "host": "feed returned tensors into the next step; host owns sampling and stopping",
    "input": [],
    "maximum_input_history": null,
    "output": [
      "present_0_key",
      "present_0_value"
    ],
    "semantics": "named self/cross-attention K/V tensors; batch x heads x history x head dimension"
  },
  "tolerances": {
    "atol": 1e-05,
    "rtol": 0.0001
  },
  "verified_cases": 2,
  "weights": {
    "kind": "random",
    "model_seed": 0
  }
}
