{
  "artifact_id": "time-series-small/time-series/tiny/forward/fp32/dynamo/static",
  "call": {
    "args": [],
    "kwargs": [
      "past_values",
      "past_time_features",
      "past_observed_mask",
      "static_categorical_features",
      "static_real_features",
      "future_time_features"
    ],
    "outputs": "tensor_tuple"
  },
  "config_sha256": "eec99da959cffd0cf1f1e693e432e7f436a108b6c9839f9397345ac4275e1527",
  "dialect": "functional",
  "dynamic_constraints": {},
  "exporter": {
    "attention": "eager",
    "cache": false,
    "name": "DynamoExporter",
    "shape_policy": "static",
    "strict": false
  },
  "files": {
    "captures.json": "9ecd45cd600d535f734fa513943c4f47907b40b3caa7a63ba2124154cbf32427",
    "cases.json": "2d30491427b52d71577c0511ebb1f09348d95c230b50c950e388276b2a42686c",
    "data/constants/model_constants_config.json": "0d2b162cf55d82c3a4e6f146869172adb14d701c8276bcfadd953ca0d12aeee3",
    "data/weights/model_weights_config.json": "715db21cd308614feeb5c1714aa0d0b487f657f550c310b86c5058a1b64ee316",
    "models/model.json": "ecad6c547c097fd4dfb65cc7635585232daaaf4ac96e7134dbfcfd92aab4aa19"
  },
  "graph_sha256": "ecad6c547c097fd4dfb65cc7635585232daaaf4ac96e7134dbfcfd92aab4aa19",
  "inputs": [
    {
      "dtype": "float32",
      "name": "past_values",
      "shape": [
        1,
        61
      ]
    },
    {
      "dtype": "float32",
      "name": "past_time_features",
      "shape": [
        1,
        61,
        2
      ]
    },
    {
      "dtype": "float32",
      "name": "past_observed_mask",
      "shape": [
        1,
        61
      ]
    },
    {
      "dtype": "int64",
      "name": "static_categorical_features",
      "shape": [
        1,
        1
      ]
    },
    {
      "dtype": "float32",
      "name": "static_real_features",
      "shape": [
        1,
        1
      ]
    },
    {
      "dtype": "float32",
      "name": "future_time_features",
      "shape": [
        1,
        24,
        2
      ]
    }
  ],
  "load_dependencies": [
    "torch"
  ],
  "model_class": "TimeSeriesTransformerModel",
  "model_id": "time-series-small",
  "mutations": [],
  "outputs": [
    {
      "dtype": "float32",
      "name": "last_hidden_state",
      "shape": [
        1,
        1,
        26
      ]
    },
    {
      "dtype": "float32",
      "name": "encoder_last_hidden_state",
      "shape": [
        1,
        24,
        26
      ]
    },
    {
      "dtype": "float32",
      "name": "loc",
      "shape": [
        1,
        1
      ]
    },
    {
      "dtype": "float32",
      "name": "scale",
      "shape": [
        1,
        1
      ]
    }
  ],
  "population": "tiny",
  "producer": {
    "architecture": "aarch64",
    "core_override": false,
    "core_revision": "ec594858e9ac79619a2a3e4ba2536945e6975c30",
    "core_source_sha256": "ba920d4dc0ffce490cd1ac2391144907ff417bbc7abe75437515e0e4468b525d",
    "device": "cpu",
    "lock_sha256": "9aa194935d71c862f87b53010a57357fb088e780c879ef23d9aca129f4d11fab",
    "python": "3.13.12",
    "tools_sha256": "5c04fc6dcc4451b35c2255ab00777a89d7b7988b2fc7180f3a2cfff062accba4",
    "versions": {
      "numpy": "2.5.3",
      "pt2-export-core": "0.1.0",
      "safetensors": "0.8.0",
      "torch": "2.13.0+cpu",
      "torchvision": "0.28.0+cpu",
      "transformers": "5.18.0"
    }
  },
  "recipe_sha256": "f7021159aa174a06d6b618cc7cffe71f9109c8cca4837951165b20bfc7f7071d",
  "schema_version": 1,
  "tolerances": {
    "atol": 1e-05,
    "rtol": 0.0001
  },
  "verified_cases": 2,
  "weights": {
    "kind": "random",
    "model_seed": 0
  }
}
