{
  "artifact_id": "videomae-small/video-classification/tiny/forward/fp32/dynamo/static",
  "call": {
    "args": [],
    "kwargs": [
      "pixel_values"
    ],
    "outputs": "tensor_tuple"
  },
  "config_sha256": "d9f305bc19f4e7373cfc820c49e4460a1e48de56cd2cc945df110897de0fc153",
  "dialect": "functional",
  "dynamic_constraints": {},
  "exporter": {
    "attention": "eager",
    "cache": false,
    "name": "DynamoExporter",
    "shape_policy": "static",
    "strict": false
  },
  "files": {
    "captures.json": "f74274ae389a3a183c48c172b2908b1821b5673588870df21b2a392fd98c3c22",
    "cases.json": "ec15c217f3b9f77cda13ca890d8f186fff07367c5dbd9a0a41f531facecda054",
    "data/constants/model_constants_config.json": "1074f3cce3b78a0a08caa2f19615556a3f55083ade45a27a5f67a75438458040",
    "data/weights/model_weights_config.json": "47c115d59b01d73766801a3ff302d6502a98dbf88d8f83f589e1dad4192a22eb",
    "models/model.json": "2c552325aa261ec59e73b5a551ed7720a8a1aabdc1e903f7cab60bf1e88aa5e9"
  },
  "graph_sha256": "2c552325aa261ec59e73b5a551ed7720a8a1aabdc1e903f7cab60bf1e88aa5e9",
  "inputs": [
    {
      "dtype": "float32",
      "name": "pixel_values",
      "shape": [
        1,
        4,
        3,
        32,
        32
      ]
    }
  ],
  "load_dependencies": [
    "torch"
  ],
  "model_class": "VideoMAEForVideoClassification",
  "model_id": "videomae-small",
  "mutations": [],
  "outputs": [
    {
      "dtype": "float32",
      "name": "logits",
      "shape": [
        1,
        10
      ]
    }
  ],
  "population": "tiny",
  "producer": {
    "architecture": "aarch64",
    "core_override": false,
    "core_revision": "ec594858e9ac79619a2a3e4ba2536945e6975c30",
    "core_source_sha256": "ba920d4dc0ffce490cd1ac2391144907ff417bbc7abe75437515e0e4468b525d",
    "device": "cpu",
    "lock_sha256": "9aa194935d71c862f87b53010a57357fb088e780c879ef23d9aca129f4d11fab",
    "python": "3.13.12",
    "tools_sha256": "5c04fc6dcc4451b35c2255ab00777a89d7b7988b2fc7180f3a2cfff062accba4",
    "versions": {
      "numpy": "2.5.3",
      "pt2-export-core": "0.1.0",
      "safetensors": "0.8.0",
      "torch": "2.13.0+cpu",
      "torchvision": "0.28.0+cpu",
      "transformers": "5.18.0"
    }
  },
  "recipe_sha256": "a8f529afd086cba239791c461be95e6f64a8d484a34cad1b508b01370547fe30",
  "schema_version": 1,
  "tolerances": {
    "atol": 1e-05,
    "rtol": 0.0001
  },
  "verified_cases": 2,
  "weights": {
    "kind": "random",
    "model_seed": 0
  }
}
