{
  "artifact_id": "smollm2-135m/text-decoder/tiny/decode/fp32/dynamo/dynamic",
  "call": {
    "args": [],
    "kwargs": [
      "input_ids",
      "attention_mask",
      "past_0_key",
      "past_0_value",
      "past_1_key",
      "past_1_value"
    ],
    "outputs": "tensor_tuple"
  },
  "config_sha256": "4c3024674d80d4d50d660a96199308fb2b795d922b9482c6c682c61db3a084c2",
  "dialect": "functional",
  "dynamic_constraints": {
    "attention_length": "history+1",
    "history": [
      1,
      8
    ]
  },
  "exporter": {
    "attention": "eager",
    "cache": true,
    "name": "DynamoExporter",
    "shape_policy": "dynamic",
    "strict": false
  },
  "files": {
    "captures.json": "b4e3d09fac86b63b1782a0e105c4b2d27cd5ebfb19e376c8d33eaf1e99a67f4f",
    "cases.json": "d309d6a7948b3689f5d2c55919582c3759bd6e11b0574c8797948ca0256956b3",
    "data/constants/model_constants_config.json": "3cc2da90f11b11f7eed8ab63460773e78eccc22e8b20b065d9ad63e73b2b3dee",
    "data/weights/model_weights_config.json": "2f8aeb5d33021d2f61412014e1756536a079fdcdac6667a85fda1a916ef296f0",
    "models/model.json": "abab6bf77e817556de2fdf448a0a461879c5141d793bbfd02ecb3a283bf9ae29"
  },
  "graph_sha256": "abab6bf77e817556de2fdf448a0a461879c5141d793bbfd02ecb3a283bf9ae29",
  "inputs": [
    {
      "dtype": "int64",
      "name": "input_ids",
      "shape": [
        1,
        1
      ]
    },
    {
      "dtype": "int64",
      "name": "attention_mask",
      "shape": [
        1,
        5
      ]
    },
    {
      "dtype": "float32",
      "name": "past_0_key",
      "shape": [
        1,
        2,
        4,
        16
      ]
    },
    {
      "dtype": "float32",
      "name": "past_0_value",
      "shape": [
        1,
        2,
        4,
        16
      ]
    },
    {
      "dtype": "float32",
      "name": "past_1_key",
      "shape": [
        1,
        2,
        4,
        16
      ]
    },
    {
      "dtype": "float32",
      "name": "past_1_value",
      "shape": [
        1,
        2,
        4,
        16
      ]
    }
  ],
  "load_dependencies": [
    "torch"
  ],
  "model_class": "LlamaForCausalLM",
  "model_id": "smollm2-135m",
  "mutations": [],
  "outputs": [
    {
      "dtype": "float32",
      "name": "logits",
      "shape": [
        1,
        1,
        256
      ]
    },
    {
      "dtype": "float32",
      "name": "present_0_key",
      "shape": [
        1,
        2,
        5,
        16
      ]
    },
    {
      "dtype": "float32",
      "name": "present_0_value",
      "shape": [
        1,
        2,
        5,
        16
      ]
    },
    {
      "dtype": "float32",
      "name": "present_1_key",
      "shape": [
        1,
        2,
        5,
        16
      ]
    },
    {
      "dtype": "float32",
      "name": "present_1_value",
      "shape": [
        1,
        2,
        5,
        16
      ]
    }
  ],
  "population": "tiny",
  "producer": {
    "architecture": "aarch64",
    "core_override": false,
    "core_revision": "ec594858e9ac79619a2a3e4ba2536945e6975c30",
    "core_source_sha256": "ba920d4dc0ffce490cd1ac2391144907ff417bbc7abe75437515e0e4468b525d",
    "device": "cpu",
    "lock_sha256": "9aa194935d71c862f87b53010a57357fb088e780c879ef23d9aca129f4d11fab",
    "python": "3.13.12",
    "tools_sha256": "5c04fc6dcc4451b35c2255ab00777a89d7b7988b2fc7180f3a2cfff062accba4",
    "versions": {
      "numpy": "2.5.3",
      "pt2-export-core": "0.1.0",
      "safetensors": "0.8.0",
      "torch": "2.13.0+cpu",
      "torchvision": "0.28.0+cpu",
      "transformers": "5.18.0"
    }
  },
  "recipe_sha256": "bf2ed770244c003a61fa005f11a0967f13981975b2c3febb4e30dfa632130174",
  "schema_version": 1,
  "state": {
    "host": "feed returned tensors into the next step; host owns sampling and stopping",
    "input": [
      "past_0_key",
      "past_0_value",
      "past_1_key",
      "past_1_value"
    ],
    "maximum_input_history": 8,
    "output": [
      "present_0_key",
      "present_0_value",
      "present_1_key",
      "present_1_value"
    ],
    "semantics": "named self/cross-attention K/V tensors; batch x heads x history x head dimension"
  },
  "tolerances": {
    "atol": 1e-05,
    "rtol": 0.0001
  },
  "verified_cases": 6,
  "weights": {
    "kind": "random",
    "model_seed": 0
  }
}
