{
  "artifact_id": "smollm2-135m/text-decoder/tiny/decode/fp32/dynamo/static-h8",
  "call": {
    "args": [],
    "kwargs": [
      "input_ids",
      "attention_mask",
      "past_0_key",
      "past_0_value",
      "past_1_key",
      "past_1_value"
    ],
    "outputs": "tensor_tuple"
  },
  "config_sha256": "4c3024674d80d4d50d660a96199308fb2b795d922b9482c6c682c61db3a084c2",
  "dialect": "functional",
  "dynamic_constraints": {},
  "exporter": {
    "attention": "eager",
    "cache": true,
    "name": "DynamoExporter",
    "shape_policy": "static",
    "strict": false
  },
  "files": {
    "captures.json": "0141f677c76595c640e26dd6bdcdd8f50a6d4e7720fd9a5dd7b8312e5d394e58",
    "cases.json": "63d364cd1fb9e2ffcce633672234a7d37b2993eec69ca30963358b2d33259d49",
    "data/constants/model_constants_config.json": "3cc2da90f11b11f7eed8ab63460773e78eccc22e8b20b065d9ad63e73b2b3dee",
    "data/weights/model_weights_config.json": "2f8aeb5d33021d2f61412014e1756536a079fdcdac6667a85fda1a916ef296f0",
    "models/model.json": "fb8c98ace000b28fa35b5f2f841fb3298c920a492c2ebc77935d2bd6a2dc48e3"
  },
  "graph_sha256": "fb8c98ace000b28fa35b5f2f841fb3298c920a492c2ebc77935d2bd6a2dc48e3",
  "inputs": [
    {
      "dtype": "int64",
      "name": "input_ids",
      "shape": [
        1,
        1
      ]
    },
    {
      "dtype": "int64",
      "name": "attention_mask",
      "shape": [
        1,
        9
      ]
    },
    {
      "dtype": "float32",
      "name": "past_0_key",
      "shape": [
        1,
        2,
        8,
        16
      ]
    },
    {
      "dtype": "float32",
      "name": "past_0_value",
      "shape": [
        1,
        2,
        8,
        16
      ]
    },
    {
      "dtype": "float32",
      "name": "past_1_key",
      "shape": [
        1,
        2,
        8,
        16
      ]
    },
    {
      "dtype": "float32",
      "name": "past_1_value",
      "shape": [
        1,
        2,
        8,
        16
      ]
    }
  ],
  "load_dependencies": [
    "torch"
  ],
  "model_class": "LlamaForCausalLM",
  "model_id": "smollm2-135m",
  "mutations": [],
  "outputs": [
    {
      "dtype": "float32",
      "name": "logits",
      "shape": [
        1,
        1,
        256
      ]
    },
    {
      "dtype": "float32",
      "name": "present_0_key",
      "shape": [
        1,
        2,
        9,
        16
      ]
    },
    {
      "dtype": "float32",
      "name": "present_0_value",
      "shape": [
        1,
        2,
        9,
        16
      ]
    },
    {
      "dtype": "float32",
      "name": "present_1_key",
      "shape": [
        1,
        2,
        9,
        16
      ]
    },
    {
      "dtype": "float32",
      "name": "present_1_value",
      "shape": [
        1,
        2,
        9,
        16
      ]
    }
  ],
  "population": "tiny",
  "producer": {
    "architecture": "aarch64",
    "core_override": false,
    "core_revision": "ec594858e9ac79619a2a3e4ba2536945e6975c30",
    "core_source_sha256": "ba920d4dc0ffce490cd1ac2391144907ff417bbc7abe75437515e0e4468b525d",
    "device": "cpu",
    "lock_sha256": "9aa194935d71c862f87b53010a57357fb088e780c879ef23d9aca129f4d11fab",
    "python": "3.13.12",
    "tools_sha256": "d0fccadcd4d8862038e5d18e23227d78fd6de583b6c6ae4e7a9b7e99439dc0a4",
    "versions": {
      "numpy": "2.5.3",
      "pt2-export-core": "0.1.0",
      "safetensors": "0.8.0",
      "torch": "2.13.0+cpu",
      "torchvision": "0.28.0+cpu",
      "transformers": "5.18.0"
    }
  },
  "recipe_sha256": "b584ff04589b53c2ed0041d1855f1f45ea53510a6f0eaf817c8bdec9760731f2",
  "schema_version": 1,
  "state": {
    "host": "feed returned tensors into the next step; host owns sampling and stopping",
    "input": [
      "past_0_key",
      "past_0_value",
      "past_1_key",
      "past_1_value"
    ],
    "maximum_input_history": 8,
    "output": [
      "present_0_key",
      "present_0_value",
      "present_1_key",
      "present_1_value"
    ],
    "semantics": "named self/cross-attention K/V tensors; batch x heads x history x head dimension"
  },
  "tolerances": {
    "atol": 1e-05,
    "rtol": 0.0001
  },
  "variant": {
    "attention_length": 9,
    "history": 8,
    "kind": "static-history"
  },
  "verified_cases": 2,
  "weights": {
    "kind": "random",
    "model_seed": 0
  }
}
