{
  "artifact_id": "smolvlm-256m/image-text-generation/tiny/decode/fp32/dynamo/dynamic",
  "call": {
    "args": [],
    "kwargs": [
      "input_ids",
      "attention_mask",
      "past_0_key",
      "past_0_value"
    ],
    "outputs": "tensor_tuple"
  },
  "config_sha256": "7677cec9d8f4344ac0b5db796ace02c20986f8934d5625dcb0f5885a936ef34e",
  "dialect": "functional",
  "dynamic_constraints": {
    "attention_length": "history+1",
    "history": [
      1,
      16
    ]
  },
  "exporter": {
    "attention": "eager",
    "cache": true,
    "name": "DynamoExporter",
    "shape_policy": "dynamic",
    "strict": false
  },
  "files": {
    "captures.json": "47ba29f46ecc0d4857cc7f1ca252f04daf6300310761e7e3ab98460b5f7d8790",
    "cases.json": "4594ce27c9b2658bdcecbaa8bcd0a88076c7342699ee0db799c22cfa7974a712",
    "data/constants/model_constants_config.json": "702cf97b0f70b375ec872435f75271ef5693ba0446d120e1ed289144cc2cd416",
    "data/weights/model_weights_config.json": "a3d4f0715154c3bb861c3e9aa4f78201fe462679792f4fbdb0c3535474d0f297",
    "models/model.json": "bc7975c1d180fdeae3e1dd9c2639dc8886581d10800a556814652775a6d87ea7"
  },
  "graph_sha256": "bc7975c1d180fdeae3e1dd9c2639dc8886581d10800a556814652775a6d87ea7",
  "inputs": [
    {
      "dtype": "int64",
      "name": "input_ids",
      "shape": [
        1,
        1
      ]
    },
    {
      "dtype": "int64",
      "name": "attention_mask",
      "shape": [
        1,
        12
      ]
    },
    {
      "dtype": "float32",
      "name": "past_0_key",
      "shape": [
        1,
        1,
        11,
        32
      ]
    },
    {
      "dtype": "float32",
      "name": "past_0_value",
      "shape": [
        1,
        1,
        11,
        32
      ]
    }
  ],
  "load_dependencies": [
    "torch"
  ],
  "model_class": "Idefics3ForConditionalGeneration",
  "model_id": "smolvlm-256m",
  "mutations": [],
  "outputs": [
    {
      "dtype": "float32",
      "name": "logits",
      "shape": [
        1,
        1,
        256
      ]
    },
    {
      "dtype": "float32",
      "name": "present_0_key",
      "shape": [
        1,
        1,
        12,
        32
      ]
    },
    {
      "dtype": "float32",
      "name": "present_0_value",
      "shape": [
        1,
        1,
        12,
        32
      ]
    }
  ],
  "population": "tiny",
  "producer": {
    "architecture": "aarch64",
    "core_override": false,
    "core_revision": "ec594858e9ac79619a2a3e4ba2536945e6975c30",
    "core_source_sha256": "ba920d4dc0ffce490cd1ac2391144907ff417bbc7abe75437515e0e4468b525d",
    "device": "cpu",
    "lock_sha256": "9aa194935d71c862f87b53010a57357fb088e780c879ef23d9aca129f4d11fab",
    "python": "3.13.12",
    "tools_sha256": "5fa008b8e1c6209ffd910248a6babd8348db0e16d4c1de28d64181732e2dee33",
    "versions": {
      "numpy": "2.5.3",
      "pt2-export-core": "0.1.0",
      "safetensors": "0.8.0",
      "torch": "2.13.0+cpu",
      "torchvision": "0.28.0+cpu",
      "transformers": "5.18.0"
    }
  },
  "recipe_sha256": "3a8ba48018fbe4978496edd4dd4d7c4afd98549924752d664d3a470f3a10af03",
  "schema_version": 1,
  "state": {
    "host": "feed returned tensors into the next step; host owns sampling and stopping",
    "input": [
      "past_0_key",
      "past_0_value"
    ],
    "maximum_input_history": 16,
    "output": [
      "present_0_key",
      "present_0_value"
    ],
    "semantics": "named self/cross-attention K/V tensors; batch x heads x history x head dimension"
  },
  "tolerances": {
    "atol": 1e-05,
    "rtol": 0.0001
  },
  "verified_cases": 7,
  "weights": {
    "kind": "random",
    "model_seed": 0
  }
}
