{
  "artifact_id": "tinyclip/image-text-embeddings/tiny/image-encoder/fp32/dynamo/static",
  "call": {
    "args": [],
    "kwargs": [
      "pixel_values"
    ],
    "outputs": "tensor_tuple"
  },
  "config_sha256": "b68e1715c8d7a69357dbab2692b4bd59a31bfa87bc74f897c141504b4accd746",
  "dialect": "functional",
  "dynamic_constraints": {},
  "exporter": {
    "attention": "eager",
    "cache": false,
    "name": "DynamoExporter",
    "shape_policy": "static",
    "strict": false
  },
  "files": {
    "captures.json": "b1d0c6cd99549a2c9422d8781276a0a280c240e1d94e3c45b76df53c60a518ce",
    "cases.json": "b181b53bf9acb1046b6f3d11c18512ed9e6a6fd9b079a1ddd1b68efde1e53e12",
    "data/constants/model_constants_config.json": "ec6d8ae7d6023e8dd274662f429a4a9e222e8f19dcf176702ccd0105a4491a54",
    "data/weights/model_weights_config.json": "4df2dfdd9e11dc3f3cd0920544f5251a666e97b8742e912624541ec6ca969275",
    "models/model.json": "986eb84ed4bc900e79e7f9220b1cc0e183c41f6746f3bf264d6c1e83b2eebfee"
  },
  "graph_sha256": "986eb84ed4bc900e79e7f9220b1cc0e183c41f6746f3bf264d6c1e83b2eebfee",
  "inputs": [
    {
      "dtype": "float32",
      "name": "pixel_values",
      "shape": [
        1,
        3,
        32,
        32
      ]
    }
  ],
  "load_dependencies": [
    "torch"
  ],
  "model_class": "CLIPModel",
  "model_id": "tinyclip",
  "mutations": [],
  "outputs": [
    {
      "dtype": "float32",
      "name": "image_features",
      "shape": [
        1,
        64
      ]
    }
  ],
  "population": "tiny",
  "producer": {
    "architecture": "aarch64",
    "core_override": false,
    "core_revision": "ec594858e9ac79619a2a3e4ba2536945e6975c30",
    "core_source_sha256": "ba920d4dc0ffce490cd1ac2391144907ff417bbc7abe75437515e0e4468b525d",
    "device": "cpu",
    "lock_sha256": "9aa194935d71c862f87b53010a57357fb088e780c879ef23d9aca129f4d11fab",
    "python": "3.13.12",
    "tools_sha256": "d0fccadcd4d8862038e5d18e23227d78fd6de583b6c6ae4e7a9b7e99439dc0a4",
    "versions": {
      "numpy": "2.5.3",
      "pt2-export-core": "0.1.0",
      "safetensors": "0.8.0",
      "torch": "2.13.0+cpu",
      "torchvision": "0.28.0+cpu",
      "transformers": "5.18.0"
    }
  },
  "recipe_sha256": "6af1093a6bb4457d49a2d4028fbde991f95516dad1b834e20a0fce6599cbf6bb",
  "schema_version": 1,
  "tolerances": {
    "atol": 1e-05,
    "rtol": 0.0001
  },
  "verified_cases": 2,
  "weights": {
    "kind": "random",
    "model_seed": 0
  }
}
