{
  "artifact_id": "smolvlm-256m/image-text-generation/tiny/connector/fp32/dynamo/static",
  "call": {
    "args": [],
    "kwargs": [
      "hidden_states"
    ],
    "outputs": "tensor_tuple"
  },
  "config_sha256": "7677cec9d8f4344ac0b5db796ace02c20986f8934d5625dcb0f5885a936ef34e",
  "dialect": "functional",
  "dynamic_constraints": {},
  "exporter": {
    "attention": "eager",
    "cache": false,
    "name": "DynamoExporter",
    "shape_policy": "static",
    "strict": false
  },
  "files": {
    "captures.json": "a6c8647fbfbbacf0c68dfca64ebb3394206ec57a24cb1cef1610e28a52c13473",
    "cases.json": "55e15560dada8fcd49ca71989a46fdd558238d59600635af7a675bdcb68e3244",
    "data/constants/model_constants_config.json": "65d03bbad65e3dea69e6ee49d647c46718ea0cae617aa3d65b257409c3365079",
    "data/weights/model_weights_config.json": "7ecdd9cf264a032364c671683eb215a275857749d9b7f449ee3f7dd35888fe5c",
    "models/model.json": "652baef0166302ffb851c740364a021ba5f89d2b5fcbca05839d4e694880e6c1"
  },
  "graph_sha256": "652baef0166302ffb851c740364a021ba5f89d2b5fcbca05839d4e694880e6c1",
  "inputs": [
    {
      "dtype": "float32",
      "name": "hidden_states",
      "shape": [
        1,
        16,
        32
      ]
    }
  ],
  "load_dependencies": [
    "torch"
  ],
  "model_class": "Idefics3ForConditionalGeneration",
  "model_id": "smolvlm-256m",
  "mutations": [],
  "outputs": [
    {
      "dtype": "float32",
      "name": "image_features",
      "shape": [
        1,
        4,
        64
      ]
    }
  ],
  "population": "tiny",
  "producer": {
    "architecture": "aarch64",
    "core_override": false,
    "core_revision": "ec594858e9ac79619a2a3e4ba2536945e6975c30",
    "core_source_sha256": "ba920d4dc0ffce490cd1ac2391144907ff417bbc7abe75437515e0e4468b525d",
    "device": "cpu",
    "lock_sha256": "9aa194935d71c862f87b53010a57357fb088e780c879ef23d9aca129f4d11fab",
    "python": "3.13.12",
    "tools_sha256": "d0fccadcd4d8862038e5d18e23227d78fd6de583b6c6ae4e7a9b7e99439dc0a4",
    "versions": {
      "numpy": "2.5.3",
      "pt2-export-core": "0.1.0",
      "safetensors": "0.8.0",
      "torch": "2.13.0+cpu",
      "torchvision": "0.28.0+cpu",
      "transformers": "5.18.0"
    }
  },
  "recipe_sha256": "c45b507ae5fcb0fd6aa89ebdb14eb4bcd4c869d18c903ed180fc723c5a23ec6d",
  "schema_version": 1,
  "tolerances": {
    "atol": 1e-05,
    "rtol": 0.0001
  },
  "verified_cases": 2,
  "weights": {
    "kind": "random",
    "model_seed": 0
  }
}
