{
  "artifact_id": "t5-small/text-encoder-decoder/tiny/encoder/fp32/dynamo/static",
  "call": {
    "args": [],
    "kwargs": [
      "input_ids",
      "attention_mask"
    ],
    "outputs": "tensor_tuple"
  },
  "config_sha256": "12deeccc749252a35c955441517cc0ecb6a88508e0ffa5b57b8a1e92bda334ea",
  "dialect": "functional",
  "dynamic_constraints": {},
  "exporter": {
    "attention": "eager",
    "cache": false,
    "name": "DynamoExporter",
    "shape_policy": "static",
    "strict": false
  },
  "files": {
    "captures.json": "7749cf52d4854e7b2f6bb531701c812a88c418714bdf0a563b994683ee9010c7",
    "cases.json": "89e2b287286e86a929babff050cd108fa687fe35abd960a870591136d6ed1a43",
    "data/constants/model_constants_config.json": "887bf4cc1b0dfea3bdb999c93edd75d68b15e71096d14c738bd30070672977e2",
    "data/weights/model_weights_config.json": "e5a0849ef1a3f651e1aa6e8de1f8d123c2884d6cf527ec73ec36c87593227077",
    "models/model.json": "61f8351810f91d678b7f9b6ab24addb4ed47963f1bd6365a1d65d41eec268016"
  },
  "graph_sha256": "61f8351810f91d678b7f9b6ab24addb4ed47963f1bd6365a1d65d41eec268016",
  "inputs": [
    {
      "dtype": "int64",
      "name": "input_ids",
      "shape": [
        1,
        16
      ]
    },
    {
      "dtype": "int64",
      "name": "attention_mask",
      "shape": [
        1,
        16
      ]
    }
  ],
  "load_dependencies": [
    "torch"
  ],
  "model_class": "T5ForConditionalGeneration",
  "model_id": "t5-small",
  "mutations": [],
  "outputs": [
    {
      "dtype": "float32",
      "name": "encoder_hidden_states",
      "shape": [
        1,
        16,
        64
      ]
    }
  ],
  "population": "tiny",
  "producer": {
    "architecture": "aarch64",
    "core_override": false,
    "core_revision": "ec594858e9ac79619a2a3e4ba2536945e6975c30",
    "core_source_sha256": "ba920d4dc0ffce490cd1ac2391144907ff417bbc7abe75437515e0e4468b525d",
    "device": "cpu",
    "lock_sha256": "9aa194935d71c862f87b53010a57357fb088e780c879ef23d9aca129f4d11fab",
    "python": "3.13.12",
    "tools_sha256": "d0fccadcd4d8862038e5d18e23227d78fd6de583b6c6ae4e7a9b7e99439dc0a4",
    "versions": {
      "numpy": "2.5.3",
      "pt2-export-core": "0.1.0",
      "safetensors": "0.8.0",
      "torch": "2.13.0+cpu",
      "torchvision": "0.28.0+cpu",
      "transformers": "5.18.0"
    }
  },
  "recipe_sha256": "dbd2540839405dda634a38efd6c114651ddcac2e58549a53638bf7f552225489",
  "schema_version": 1,
  "tolerances": {
    "atol": 1e-05,
    "rtol": 0.0001
  },
  "verified_cases": 2,
  "weights": {
    "kind": "random",
    "model_seed": 0
  }
}
